id,return_id,issue_date,resolve_date,complaint
5b598a0d-8996-48ed-87dd-80fd850e3ce2,37315687-a543-4344-8e7c-6b3503e5e2d0,2023-10-31 00:00:00,2023-11-04 00:00:00,Spór wzdłuż północ wieczór.
9c05ad50-2e17-4b15-ab97-9f1678cc3fb6,f4a5ffd5-a74f-4187-a379-e75cf32a5e62,2023-04-26 00:00:00,2023-05-03 00:00:00,Podczas ulica dach 40 zmienić.
c7a5533a-4dec-4559-92c5-b0364ea29d1b,f4a5ffd5-a74f-4187-a379-e75cf32a5e62,2024-04-03 00:00:00,2024-04-05 00:00:00,Pod bóg poważny wysokość czterdzieści lotniczy badać.
50861485-910a-44b0-8820-dd687e25a1ee,f4a5ffd5-a74f-4187-a379-e75cf32a5e62,2024-02-03 00:00:00,2024-02-12 00:00:00,Analiza rozmawiać dach sierpień samica.
a9ae0252-61bc-47e0-960d-fed82bbe6c26,37315687-a543-4344-8e7c-6b3503e5e2d0,2023-10-24 00:00:00,2023-11-02 00:00:00,Otwierać zgoda uczyć się wskazywać radio oni.
e627220e-b730-44b5-b557-8c0ef5044bd4,2c8d274b-e56e-48a7-9d87-1d1654c37aa3,2023-10-18 00:00:00,2023-10-21 00:00:00,Południe Węgry cierpieć miejski Japonia.
859f7fcc-35f7-4297-abbc-e2d62f7f9858,4e72af1c-c960-4fa7-8dd9-955d47006eb8,2024-07-03 00:00:00,2024-07-10 00:00:00,Wrzesień obrót lotnisko muzyka szczególnie wzrok.
64b9212f-5411-4533-b874-a117bd83632b,e911f1d6-d7d5-4236-9c41-468199323cf6,2023-08-23 00:00:00,2023-09-01 00:00:00,Podłoga przychodzić plac seksualny łaciński morski małpa.
7be26faf-93d6-4f1d-b637-bd42444b7c90,37315687-a543-4344-8e7c-6b3503e5e2d0,2024-06-28 00:00:00,2024-07-01 00:00:00,Polak ręka czwartek tarcza nad powinien.
03a7a97a-7de1-4372-bed1-6f3dc739f319,2c8d274b-e56e-48a7-9d87-1d1654c37aa3,2023-10-26 00:00:00,2023-11-02 00:00:00,Tutaj gospodarczy głód dorosły.
2137d0dc-702d-4aa8-ae8c-cc34b9feacaa,50f7e288-efce-4a2c-b92f-6fb589aa19c4,2024-04-13 00:00:00,2024-04-23 00:00:00,Na Przykład przybyć matematyka wolno zgadzać się.
e9044e54-81d9-437e-8ba0-4e6abd095bf1,44f89eec-201b-4072-b71d-b04980b3fbf8,2024-09-14 00:00:00,2024-09-19 00:00:00,Państwowy płakać amharski funkcja pociąg narodowość.
66ca54e7-c894-4c7d-979a-d8de9381b4a9,e911f1d6-d7d5-4236-9c41-468199323cf6,2024-02-26 00:00:00,2024-03-07 00:00:00,Orzeł nauczyciel bo dawny spaść bycie piątek składać się.
e660ef91-8c22-4a13-bb74-4c399480b7ea,2c8d274b-e56e-48a7-9d87-1d1654c37aa3,2023-08-30 00:00:00,2023-09-09 00:00:00,Popularny maj jezioro tytuł.
5fbb96e3-3719-4eba-a1ee-7f085f8014f9,b64a662a-7c54-405c-a075-802d38b4ccf5,2023-08-21 00:00:00,2023-08-27 00:00:00,Tył rejon dostać Niemcy.
3da3f56b-0db2-49ba-b6ab-eaae376fbe6d,55005c90-abde-446a-b266-31ed591660fe,2023-03-10 00:00:00,2023-03-17 00:00:00,Czuć chleb o lekcja.
4358703c-9290-44ee-ab81-8d1e05cdaef0,e911f1d6-d7d5-4236-9c41-468199323cf6,2023-09-08 00:00:00,2023-09-16 00:00:00,Suchy czerwony uczyć gotowy.
5cbada1d-d0b6-4ce8-a0d3-d57c69b4c906,e911f1d6-d7d5-4236-9c41-468199323cf6,2023-07-13 00:00:00,2023-07-18 00:00:00,Fabryka przyjaźń muzyka przecież odpowiedź dyskusja łuk.
9eec3ac1-7ff6-4d23-b30a-7c0f440af273,2c8d274b-e56e-48a7-9d87-1d1654c37aa3,2024-01-13 00:00:00,2024-01-17 00:00:00,Dokonać ciepło lista sobota pióro z krwi i kości tworzyć.
0897a042-8b3b-4be1-85d2-831ced580095,44f89eec-201b-4072-b71d-b04980b3fbf8,2024-03-12 00:00:00,2024-03-16 00:00:00,Okrągły surowy wykonanie.
bcacf9c4-1409-4f38-8b53-3ce0320f94c1,50f7e288-efce-4a2c-b92f-6fb589aa19c4,2024-02-01 00:00:00,2024-02-08 00:00:00,Chyba samochodowy wybrać papier.
d53ccc81-82f8-45a0-8cac-76a90735b2b0,50f7e288-efce-4a2c-b92f-6fb589aa19c4,2024-12-24 00:00:00,2025-01-01 00:00:00,Morze budzić fala wniosek gęś nos.
2d3140fa-c76d-483b-9258-81f86f84b630,b34a1c6b-c3de-463f-8f11-6b9753b053d6,2023-04-05 00:00:00,2023-04-11 00:00:00,Herb powolny mistrz.
f23666cd-5ba8-4d50-bfa6-bdb6ee7ccc6a,e911f1d6-d7d5-4236-9c41-468199323cf6,2023-06-01 00:00:00,2023-06-06 00:00:00,Księga pomagać ssak niedźwiedź koszt butelka postępowanie chłopak.
1e3d6327-df4b-4f30-b8cc-020a534f72fc,2c8d274b-e56e-48a7-9d87-1d1654c37aa3,2023-03-19 00:00:00,2023-03-21 00:00:00,Dodawać prędkość płyn.
cd1819a0-7dbb-4160-8165-c527f7ae1cf5,4e72af1c-c960-4fa7-8dd9-955d47006eb8,2023-01-27 00:00:00,2023-02-04 00:00:00,Ssak tam suchy poziom.
620268ce-4e1e-4ab6-9497-539bacbb494c,37315687-a543-4344-8e7c-6b3503e5e2d0,2024-12-11 00:00:00,2024-12-16 00:00:00,Nieprzyjemny amharski ale chleb zainteresowanie narząd.
b25fe103-d376-4a81-bcae-8be2f10e21f2,37315687-a543-4344-8e7c-6b3503e5e2d0,2024-09-01 00:00:00,2024-09-09 00:00:00,Broń międzynarodowy długość informacja praktyka.
dc69005b-af98-49c3-a6bb-20b9e4f6f02c,44f89eec-201b-4072-b71d-b04980b3fbf8,2024-09-13 00:00:00,2024-09-19 00:00:00,Żart wada bawić się ciepło państwo.
013ed093-3e3c-4196-a991-92982c753a05,4e72af1c-c960-4fa7-8dd9-955d47006eb8,2024-10-16 00:00:00,2024-10-20 00:00:00,Żeński sukces czuć obywatelka tłuszcz dokładny tylko.
7754f3a5-cb02-49be-b37e-9f79e01195cc,f4a5ffd5-a74f-4187-a379-e75cf32a5e62,2024-07-10 00:00:00,2024-07-19 00:00:00,Badać powieść koło łódź.
0ef5cd4e-e916-41b9-b654-6829d4169e23,b34a1c6b-c3de-463f-8f11-6b9753b053d6,2023-06-05 00:00:00,2023-06-09 00:00:00,Umieścić budowla przedmiot robotnik waluta.
2ecf2bc6-7f23-404f-837a-0134b1991550,55005c90-abde-446a-b266-31ed591660fe,2024-05-20 00:00:00,2024-05-28 00:00:00,Kierowca sytuacja dół zespół wynik Boże Narodzenie częściowo.
724fc9eb-bdeb-4963-ac8c-2d2f825e3300,50f7e288-efce-4a2c-b92f-6fb589aa19c4,2024-04-20 00:00:00,2024-04-26 00:00:00,Nastrój sztuczny osoba opisać.
b835fffe-6477-4c06-8987-7e6e3cca527f,b34a1c6b-c3de-463f-8f11-6b9753b053d6,2024-10-24 00:00:00,2024-10-28 00:00:00,Wykonać minuskuła mapa specjalny związany pieniądze.
80edd630-c056-44b8-9a40-fe2651808615,44f89eec-201b-4072-b71d-b04980b3fbf8,2023-11-08 00:00:00,2023-11-14 00:00:00,Policjant nocny tłum przynosić gniew odczuwać ziarno spokojny.
5652e70e-b3df-42e3-bdc3-9328ee2a4818,50f7e288-efce-4a2c-b92f-6fb589aa19c4,2024-11-22 00:00:00,2024-11-28 00:00:00,Śpiewać pies okolica gorący źródło strata koszula papież.
031435e0-d2a1-48c2-ac64-c0d78187344f,b34a1c6b-c3de-463f-8f11-6b9753b053d6,2024-08-24 00:00:00,2024-08-26 00:00:00,Sklep ludowy model okolica filmowy.
