id,return_id,issue_date,resolve_date,complaint
0d402ba8-fd83-4c1f-b801-81fc9b6c09cc,311044ec-554f-41a3-8da0-ae3854565f6c,2014-01-06 00:00:00,2014-01-09 00:00:00,Szpital ile ci ubogi.
6fae7c15-32ce-40fd-8595-4e096c59e1d9,264537ee-0d63-438c-823f-cd6c7c09253c,2001-04-21 00:00:00,2001-05-01 00:00:00,Położony urzędnik interes diabeł procent zajmować się.
92bb2668-4bce-41e4-84fb-b16e35917417,70a3eae4-1816-463f-94c5-165fbe48a8c4,2018-01-27 00:00:00,2018-02-06 00:00:00,Artysta zamiast uczyć przestępstwo.
42ea86c0-7bdb-4e9f-97d4-d93bd200d9b9,6ade46b9-8974-4c7e-b124-b8829c424c30,2008-03-26 00:00:00,2008-03-28 00:00:00,Wstyd także rządzić szybko żydowski.
19c67121-786e-4a77-a20e-f5de01314575,53c47ae0-4e2a-4b93-b02c-5c3f63ebadeb,2017-09-10 00:00:00,2017-09-20 00:00:00,Zawód więzienie umysł krótki papier ty program.
880aa476-3943-46b4-be03-81b7b41baffe,234527d0-eda9-42d5-8b44-c6f0cc69947e,2008-10-11 00:00:00,2008-10-18 00:00:00,Cierpienie biedny należy umrzeć mąż spaść.
2312374d-dc01-4cec-9d07-be5cbf82e68e,1c944037-c9a1-4c45-9e0e-73b00674f48c,2005-07-30 00:00:00,2005-08-08 00:00:00,Krótki symbol cichy przynieść oko.
193ef24f-a232-4f0d-806c-658760e6e2e6,16a6d361-bd8f-4a64-8e43-3e57b15ca4bd,2014-05-09 00:00:00,2014-05-18 00:00:00,Dno drewniany termin.
713e3350-147f-482a-9070-a03f95f272d5,5f7e35bc-d89d-47f0-b0f3-af60149d6e8c,2004-06-10 00:00:00,2004-06-15 00:00:00,Lecieć także przez wywodzić się trwać.
5292e29a-2762-4d84-b91e-2524a738e0f4,3afbd3ee-43ef-4c5c-ac35-647b4084e31b,2006-12-06 00:00:00,2006-12-10 00:00:00,Klasa pająk delikatny internetowy tradycja plecy trzy.
e31fe3ba-e21d-441d-84dd-2ebecfefe693,70591749-28ad-4e97-9c2b-92481df59cfb,2014-07-11 00:00:00,2014-07-20 00:00:00,Ogólny prawo prasa pisarz klub dodatkowy.
03c8d525-8a7e-40c7-95f4-a2ab83b25777,b198342f-842e-4c73-a6de-653b8fbe0e60,2006-06-26 00:00:00,2006-06-27 00:00:00,Wino pracownik przejście piec wiadomość.
209c2a81-6b57-495b-8dd3-05c1a8664745,04d5caf8-95ac-4051-8062-8a7cb6b78711,2022-05-19 00:00:00,2022-05-20 00:00:00,Ostry wygrać rzucać mi klasztor.
fe82369f-f75e-42b1-b13e-df4a8adcdd67,580b2899-6a34-4b42-923c-6598b3171eeb,2005-03-07 00:00:00,2005-03-11 00:00:00,Organ wielkość zabić oraz podawać dostać otrzymać.
802c29b4-0226-419a-b642-237266ca400a,89e4be1e-331f-4c5b-a9b4-1a6667128804,2014-09-13 00:00:00,2014-09-18 00:00:00,Tajemnica odcinek poeta ten sam.
f8b7008a-3c0e-458e-8177-c961b8122726,b60c4bb5-bec7-4888-8ecc-4196e3b0b48f,2007-11-29 00:00:00,2007-12-04 00:00:00,Południowy użyć przy dziedzina Polska.
eacb9e7f-98a0-48df-b348-6c7763e257d9,bbf88f94-5c4a-43cc-9965-a6a60722b081,2009-10-03 00:00:00,2009-10-13 00:00:00,Otrzymać skłonność kartka czarny nadmierny.
978365c2-c3cd-4a5c-a875-58cf0dae39f7,fc54097c-2271-4840-963c-2e84aee26a9f,2003-02-27 00:00:00,2003-03-06 00:00:00,Dwanaście przyjść specjalista owad korzystać mąka Ukraina.
599333ce-5f99-48aa-a86d-0fda647496c3,41e7e7d8-4b35-42b3-b733-ba74b160e979,2016-11-11 00:00:00,2016-11-20 00:00:00,Ci miłość częściowo źle ciężki środkowy ruch.
ec6be870-1310-4c98-a101-fedf1102c321,13f5944f-cacf-4cfc-bbb4-8dd05b63fb9f,2010-10-14 00:00:00,2010-10-16 00:00:00,Wyrok narząd ryzyko pojawiać się część nasz.
1cb911bc-0a71-44e6-8bbd-6b1ffff10f96,d8e161c1-5195-4956-949f-984898cd104e,2007-12-25 00:00:00,2008-01-04 00:00:00,Niech owca grunt rana zajęcie.
1c0ba5ae-8e2d-422c-8b59-32b4ba6a2e4c,a0cf2a04-a7fb-4b4d-9361-d61e4d0195b7,2013-10-26 00:00:00,2013-11-03 00:00:00,Mówić blisko przedstawiciel.
a179585f-4c65-4da3-8770-3074937093b6,08d51d50-f8de-4b37-bc83-287cf3416f6b,2016-02-08 00:00:00,2016-02-11 00:00:00,Określać otworzyć mądry przynieść część dostać obywatelka.
238881bd-5891-44f3-a649-38569b9fbf86,a173d729-c46f-4ac9-8f8a-52de28202cd4,2009-08-21 00:00:00,2009-08-28 00:00:00,Podstawowy powiat siedemdziesiąt próba chleb szczególny.
4d97712e-8cdc-4766-aa26-47d0b242623c,a0cf2a04-a7fb-4b4d-9361-d61e4d0195b7,2003-07-08 00:00:00,2003-07-11 00:00:00,Zdarzenie szukać ważny narodowość brązowy mocny użyć.
2170f63b-5ddf-4ff0-aac0-3175795cd1c4,bbf88f94-5c4a-43cc-9965-a6a60722b081,2018-12-22 00:00:00,2018-12-27 00:00:00,Łóżko pomoc strój urodzić skała wydawać walczyć.
43036f65-0304-4885-9616-8114855cca45,2420f3ed-214e-414e-826f-2448ba6fcb66,2009-05-03 00:00:00,2009-05-12 00:00:00,Zmiana stół mowa pieśń.
c16840db-364f-4c35-90c9-a00ccee1d7b9,7ebb2695-6845-4ab1-9dee-ed1b0f1af85f,2013-02-11 00:00:00,2013-02-19 00:00:00,Patrzeć specjalista małpa utwór liczyć szczęśliwy pociąg.
80ac89ed-88d3-49ec-a4be-3c662fcec634,02e3f8b8-93fa-4bf0-a76a-6641b71ec5cd,2001-11-16 00:00:00,2001-11-18 00:00:00,Ludność akt daleko nasiono siedem mąż.
f2640b93-fd8a-4f5f-add9-a15cb1c3cd8a,02e3f8b8-93fa-4bf0-a76a-6641b71ec5cd,2005-01-21 00:00:00,2005-01-28 00:00:00,Przyjść wybrzeże wywołać jeszcze.
25f1c4e2-4e4d-4937-ad78-bfa9621f2401,a173d729-c46f-4ac9-8f8a-52de28202cd4,2005-10-25 00:00:00,2005-10-31 00:00:00,Pustynia bardzo natura proces pióro kara obwód zakres.
31b59a7f-d7d1-4581-8206-c690fcbf8632,53c47ae0-4e2a-4b93-b02c-5c3f63ebadeb,2003-07-16 00:00:00,2003-07-18 00:00:00,Gotować ogół niedźwiedź stały gospodarczy zamykać przedstawienie.
3f043a7b-c819-4e04-9ea1-6a9b09cb389d,28c14ba0-1a9e-42f7-84b7-7a69c43ff0e1,2005-06-29 00:00:00,2005-07-06 00:00:00,Wprowadzać wzrost pieniądz gazeta daleko.
7657ce1a-ccef-4cdf-8419-a883cea35b2b,13f5944f-cacf-4cfc-bbb4-8dd05b63fb9f,2003-06-14 00:00:00,2003-06-19 00:00:00,Za anioł uczyć wydawać usuwać ubogi.
368e25f3-a526-4c24-a832-c98e83fa921e,28c14ba0-1a9e-42f7-84b7-7a69c43ff0e1,2013-01-22 00:00:00,2013-01-24 00:00:00,Ze brać związać czerwony.
7c1d7070-84d9-40ae-b3db-c344bc40fbf1,234527d0-eda9-42d5-8b44-c6f0cc69947e,2001-11-29 00:00:00,2001-12-08 00:00:00,Nadawać środa – we budować kupować.
a25daf3f-05b5-425d-a87f-b1631881b13e,fa6b30dc-9d4d-41df-9b87-9ea5e5a8b92f,2009-09-25 00:00:00,2009-09-29 00:00:00,Który drewno ramię radiowy dzisiejszy prawny.
dc5b21ea-bfff-414f-947d-75931724f201,e5fe1725-c634-476c-afc5-b2906807c63c,2004-05-16 00:00:00,2004-05-21 00:00:00,Czechy służba róg sprzedawać siedem nieszczęście.
c6c4a2fd-28ba-4dcf-9998-fc4f22487c51,c14e6d48-fb5d-4168-b664-4132f84b00af,2003-12-08 00:00:00,2003-12-16 00:00:00,Spać daleki bułgarski piec temu szef dach autor.
b95077e7-4813-4337-9648-0f1adb0f1a58,443d466b-78b7-414d-b095-ee109c7e7ad8,2001-03-28 00:00:00,2001-03-29 00:00:00,Dolny autobus dziadek urzędnik sprzedawać.
46e3ada6-e2b2-4143-b8b4-f49470b8c62d,60920b3c-e9bc-457c-936d-fb9daeec7f23,2016-02-14 00:00:00,2016-02-23 00:00:00,Ściana południowy moralny Ameryka przejście mleko szkodliwy.
7dbf448a-d592-44ce-9847-2bacff9683cb,34ef3c65-a5ac-4580-bb50-f214ff47038d,2020-08-29 00:00:00,2020-09-06 00:00:00,Babcia ważny wybrać kapelusz.
fbeda5e9-f4f8-41d6-96f8-04f218cafd5f,e5fe1725-c634-476c-afc5-b2906807c63c,2015-06-03 00:00:00,2015-06-05 00:00:00,Wszystko imię obok.
fddfe8f0-d42b-4014-90fe-d8204edeff44,1c1d21a0-156f-426a-8d25-264e43069b22,2013-08-25 00:00:00,2013-09-02 00:00:00,Zysk wieczorem ogół wpaść.
6c8d1375-e523-40c2-b685-f15c9f291ad7,f4f52807-4785-43e3-801a-3e49de2b8fef,2013-01-24 00:00:00,2013-01-27 00:00:00,Cukier widzieć wojsko wymagać kilometr Turcja czapka rodowity.
4a33691c-c06d-4770-9aca-923d7b3c2000,04d5caf8-95ac-4051-8062-8a7cb6b78711,2017-12-28 00:00:00,2017-12-31 00:00:00,Iść kaczka atak rysunek między pieniądze.
a64408d4-de05-4ce3-ba7e-0408a0490132,7c4e5f5e-73da-4dde-871c-470d60ac8f2a,2010-12-18 00:00:00,2010-12-22 00:00:00,Głód rozwój gmina płynąć.
33159b83-b795-4f1e-b5e7-117c661c73b7,f4f52807-4785-43e3-801a-3e49de2b8fef,2006-06-08 00:00:00,2006-06-10 00:00:00,Wytwarzać gniazdo Słowacja masło obserwować.
413bff58-fbaf-42ab-ab2e-59c56587c976,c34fb4be-7968-46d6-bd02-b993153d17d5,2002-01-30 00:00:00,2002-02-07 00:00:00,Odległość powstać minuta Szwajcaria międzynarodowy Kraków.
489f3352-1a06-4451-9947-bee9bc584aba,298ef5c7-f953-4574-88f1-b4499185c549,2022-01-18 00:00:00,2022-01-25 00:00:00,Przyjechać związek prawie próbować.
566df5ec-92ac-4752-ae97-651c13cb765c,26f9330f-f2d4-4411-9dce-cf95c7a0b107,2008-10-20 00:00:00,2008-10-22 00:00:00,Wniosek określenie otwór jeżeli skała promień.
2691111d-f266-4553-96fb-8db6e4ca5299,960f9e62-f9f6-4acb-9525-ea505e133d5d,2008-05-18 00:00:00,2008-05-24 00:00:00,Kierowca wodny minister pojawić się.
5d2b3884-ed45-46c9-8aef-dc6cbcb7ca0e,89e4be1e-331f-4c5b-a9b4-1a6667128804,2008-01-13 00:00:00,2008-01-17 00:00:00,Wartość zajmować się nie- brak sportowy.
6eb75603-9f71-4152-b764-39f7d9270e6e,577c970a-8706-4a2d-9960-08906cd0ca43,2000-04-02 00:00:00,2000-04-11 00:00:00,Ciągle kraina zadanie aktor pająk.
b3f83941-d01e-4b19-b260-1c872e9e4454,e9a4389d-5262-4002-98f9-179761caf84e,2001-08-28 00:00:00,2001-08-29 00:00:00,Gałąź dawny nieść ze.
a5eb395f-cb12-4c2c-862a-8c01ea594ae6,792bd08d-3bc8-4676-96e6-091540aab8d0,2022-10-07 00:00:00,2022-10-10 00:00:00,Sprawiać kawa wszelki uchodzić.
3f7bc23a-c250-4e82-81ef-fc6cf126186e,b198342f-842e-4c73-a6de-653b8fbe0e60,2016-07-02 00:00:00,2016-07-07 00:00:00,Zaczynać umieć słuchać wino.
78a7ba2c-c491-4db3-a99f-b1a296cc4a80,315c38ae-c8c7-450c-b749-7eb9ff75f91f,2022-11-27 00:00:00,2022-11-30 00:00:00,Plac wierzyć uznawać.
9ee3813d-4506-404a-bc1e-fef241393cda,53c47ae0-4e2a-4b93-b02c-5c3f63ebadeb,2020-09-30 00:00:00,2020-10-06 00:00:00,Słuchać wiadomość jeść muzyczny.
8f1efb0f-8339-4dc2-8cc4-f3fb67d28ffd,08d51d50-f8de-4b37-bc83-287cf3416f6b,2012-12-23 00:00:00,2012-12-26 00:00:00,Zawierać kolejny rodzic łóżko środowisko.
f8ee6dc6-ffe3-426a-b9cb-2ecf2cd7b095,1c1d21a0-156f-426a-8d25-264e43069b22,2020-07-27 00:00:00,2020-08-03 00:00:00,Zająć położony właściwy głównie praktyka otwierać.
54be390d-5f3a-4cce-89e0-b3c6cc430d54,0952ac3e-7280-4764-8f5c-df66a46cc2e2,2013-06-16 00:00:00,2013-06-18 00:00:00,Słaby uderzać pan w końcu bar rozmowa.
bda3067e-914f-48e4-8219-706f05f54c0f,e5fe1725-c634-476c-afc5-b2906807c63c,2002-10-18 00:00:00,2002-10-26 00:00:00,Plemię też poprzedni terytorium zeszły posługiwać się.
a254fd25-b41b-42c5-8636-1babd3347603,eb9fcc7b-f0d4-4daf-be20-5ad313aad3fc,2005-07-02 00:00:00,2005-07-03 00:00:00,Czwarty zachowanie mięsień można.
6bd9c14d-2f77-4db3-b3e6-4e9d001fa6b8,2420f3ed-214e-414e-826f-2448ba6fcb66,2010-11-12 00:00:00,2010-11-16 00:00:00,Dwadzieścia martwy przyjechać arabski pierś.
9a4f83f0-7bbb-4568-8bc3-fefab7a36a0d,7ebb2695-6845-4ab1-9dee-ed1b0f1af85f,2012-06-09 00:00:00,2012-06-19 00:00:00,Taki czyjś otrzymywać błoto złożyć idea doskonały zaś.
9084fc70-ee89-493b-98a5-fd78f6e1726d,315c38ae-c8c7-450c-b749-7eb9ff75f91f,2004-08-19 00:00:00,2004-08-24 00:00:00,Liść czterdzieści tańczyć chodzić operacja sieć.
04ba6e0f-b53c-440a-a088-67387499cac4,1c1d21a0-156f-426a-8d25-264e43069b22,2019-05-14 00:00:00,2019-05-23 00:00:00,Barwa by węgiel bok.
7e696fc5-20fd-422a-aef2-d826b5b884ab,b92c45a0-d8d3-4e9d-bc53-e8e45b2932df,2015-01-18 00:00:00,2015-01-25 00:00:00,Stowarzyszenie powierzchnia czapka żółty.
71bf7536-ae04-46f9-b4e2-7c8d4f4a8c7d,e9a4389d-5262-4002-98f9-179761caf84e,2002-02-15 00:00:00,2002-02-20 00:00:00,Gdy widok przybyć osobisty świadczyć w. zbyt.
14f485c5-fee2-4745-9adf-88b354d4be91,6ade46b9-8974-4c7e-b124-b8829c424c30,2003-05-26 00:00:00,2003-06-05 00:00:00,Szczęście pociąg gardło wywodzić się koszula rzadki.
ab3eda6a-b76a-431a-a482-e9fed32f77e2,41dcb704-a0e9-4709-a501-726591d220a9,2010-02-16 00:00:00,2010-02-24 00:00:00,Gęś pacjent zapach kawa zawodnik postępować rzadki.
3b491629-011d-44c7-b998-329b5665a899,5f7e35bc-d89d-47f0-b0f3-af60149d6e8c,2004-07-17 00:00:00,2004-07-27 00:00:00,Nie działanie polityka produkt oba prawdziwy gęsty.
182b8fb6-8f9e-4b9c-a3b1-e37508813cba,bcbefef0-9afc-446c-b512-f7e258b4a1bd,2008-12-07 00:00:00,2008-12-15 00:00:00,Zamieszkiwać czerwiec szanowny substancja.
70b6135c-6a68-4a37-9a22-25a6330b7c87,a0cf2a04-a7fb-4b4d-9361-d61e4d0195b7,2013-09-24 00:00:00,2013-10-03 00:00:00,Szczęście ciemny posiłek stanowić budowla.
32d9b391-57d2-4104-97ca-4d369633589d,3afbd3ee-43ef-4c5c-ac35-647b4084e31b,2019-11-14 00:00:00,2019-11-15 00:00:00,Ocena wyjście zespół rozwój pierś.
2a50647f-19b1-4bb8-ae83-a8f7d464e888,264537ee-0d63-438c-823f-cd6c7c09253c,2014-07-04 00:00:00,2014-07-10 00:00:00,Wzrost rzecz złodziej oś.
fd2f20a1-9630-4d11-95df-54636fe3af39,61b5193e-b913-4d23-8592-307dd1e01cb0,2022-11-03 00:00:00,2022-11-08 00:00:00,Bitwa obok głupiec oddawać król.
59c5195a-8abb-4caf-a1d2-df1d59d69fc2,30a135f4-bad1-4aa6-83e8-40c1aa5628d8,2009-08-21 00:00:00,2009-08-29 00:00:00,Pochodzenie analiza psychiczny 9 naukowy przechodzić w czasie.
7b05e8ac-9b58-465a-a6a2-9bf4b5afea5d,41dcb704-a0e9-4709-a501-726591d220a9,2001-05-10 00:00:00,2001-05-16 00:00:00,Wierzyć Anglia próba sobie wygrać statek.
06a902c7-5582-4cb4-be4e-27aa7e0765e7,b92c45a0-d8d3-4e9d-bc53-e8e45b2932df,2002-02-27 00:00:00,2002-03-09 00:00:00,Kościelny reguła zwykły na zewnątrz wysokość rzeka pierś.
9a28411e-9453-4960-85ac-7f45d7770abe,c34fb4be-7968-46d6-bd02-b993153d17d5,2022-11-06 00:00:00,2022-11-13 00:00:00,Zboże wypowiedź górny.
a5e25bcf-5e77-41e9-8bf5-3ca230d1b313,839038aa-de07-4226-b5e2-b52b9c7f9995,2005-01-26 00:00:00,2005-01-28 00:00:00,Dziewiąty choć prawdziwy prawdziwy ryż.
2ac49378-25d0-4e79-9ca5-e419b6560577,1b69394c-df4c-4448-8595-1da650f4f470,2001-03-03 00:00:00,2001-03-12 00:00:00,Klucz zdolny niewielki pożar plaża stowarzyszenie wspaniały.
156c3002-9b63-4fee-a312-77c573be691a,443d466b-78b7-414d-b095-ee109c7e7ad8,2005-08-20 00:00:00,2005-08-21 00:00:00,Uciec narodowy piłka nożna partia niebo przestępstwo stopa ogień.
5124b86b-f6da-4079-b75d-4e2f0d991c6f,89aa8609-7104-4c04-99bb-2fb6ca22162a,2016-11-05 00:00:00,2016-11-11 00:00:00,Lub rejon osiemdziesiąt nieszczęście połączenie artykuł 100.
14786a64-ea9e-4a01-aa20-929a6003e3e2,c1a627a7-8277-4c90-ae7b-7d278ad53f36,2015-12-20 00:00:00,2015-12-23 00:00:00,Kostka obywatelka zanim srebrny bliski dokument.
511c712e-f13f-4746-847d-2cc2e3394c10,b4c24525-6239-41f3-86e8-aef962474ed5,2004-01-15 00:00:00,2004-01-17 00:00:00,Samochód prawdziwy okoliczność niski.
8fc0f3b0-bbf8-4136-b58f-c9f645f1832c,41dcb704-a0e9-4709-a501-726591d220a9,2022-03-08 00:00:00,2022-03-11 00:00:00,Samica brak prosić dobro.
77b69221-eec0-4782-8065-d0332f46d16e,02e3f8b8-93fa-4bf0-a76a-6641b71ec5cd,2017-10-26 00:00:00,2017-10-29 00:00:00,Podstawowy liść np. urządzenie kierowca religijny skała.
e8aef421-f43a-4bd3-b277-ea096297f004,2420f3ed-214e-414e-826f-2448ba6fcb66,2007-08-15 00:00:00,2007-08-25 00:00:00,Sześć przeciwko oba dzisiaj.
60735aa6-abcc-4378-960d-a1e8332d5a41,298ef5c7-f953-4574-88f1-b4499185c549,2020-05-16 00:00:00,2020-05-18 00:00:00,– uniwersytet środkowy prasa stado.
df3c2b5e-ea9a-455e-81ce-f4203132cec5,08d51d50-f8de-4b37-bc83-287cf3416f6b,2015-05-07 00:00:00,2015-05-11 00:00:00,Jedzenie ząb obszar uczyć się wypowiedź plecy alfabet.
acc09b46-177f-4f7c-84a5-bd7e7e61b976,30d1cc85-176c-4f86-a4ec-75d154116232,2017-02-26 00:00:00,2017-03-04 00:00:00,Trawa talerz śniadanie wąski.
4b3bda58-5990-45eb-a091-857abf24680c,08d51d50-f8de-4b37-bc83-287cf3416f6b,2011-08-23 00:00:00,2011-08-28 00:00:00,Zaufanie zaufanie alfabet całkowicie seksualny spadać.
1916d2b9-5f12-4dfa-939d-60334779e961,b198342f-842e-4c73-a6de-653b8fbe0e60,2012-04-08 00:00:00,2012-04-18 00:00:00,Zdobyć wyścig mieć na imię wyraz ten sam.
5bf3c9b9-1d7d-4983-90d1-5c79a8861eb4,41e7e7d8-4b35-42b3-b733-ba74b160e979,2012-08-05 00:00:00,2012-08-14 00:00:00,Udać Się owad powodować użytkownik pełen że 6.
839adc4c-a2a9-48b3-b283-56649bd1d9e9,13f5944f-cacf-4cfc-bbb4-8dd05b63fb9f,2011-09-02 00:00:00,2011-09-03 00:00:00,Służyć o profesor umysł dziura.
1c3e3484-561c-46af-b2da-37978e1ee0d7,1b69394c-df4c-4448-8595-1da650f4f470,2006-08-27 00:00:00,2006-08-31 00:00:00,Wygrać szybko ozdobny 30.
01a7c42f-f9d9-41da-8e38-44118e15bf9d,7c4e5f5e-73da-4dde-871c-470d60ac8f2a,2000-06-03 00:00:00,2000-06-13 00:00:00,Choć miły radiowy jego itp. kierowca.
# new data 

id,return_id,issue_date,resolve_date,complaint
ac41202b-d50a-4e41-ab81-92a06d369216,4e72af1c-c960-4fa7-8dd9-955d47006eb8,2024-04-21 00:00:00,2024-04-28 00:00:00,Tył dokładnie posługiwać się kobiecy roślina pisarz rower.
66618391-251d-46e7-8ea2-99ffa95ec75c,50f7e288-efce-4a2c-b92f-6fb589aa19c4,2023-10-20 00:00:00,2023-10-22 00:00:00,Seks lecz farba obszar początek.
4a8a1a12-baf7-4ae2-881a-730068264193,4e72af1c-c960-4fa7-8dd9-955d47006eb8,2024-05-09 00:00:00,2024-05-13 00:00:00,Epoka historyczny Australia.
e3830faa-7441-4254-9d36-52f184477b13,55005c90-abde-446a-b266-31ed591660fe,2023-01-07 00:00:00,2023-01-14 00:00:00,Francja chleb jakiś tkanina istotny.
e6712d14-d0b2-4846-8839-c793baa6d8f8,e911f1d6-d7d5-4236-9c41-468199323cf6,2024-04-28 00:00:00,2024-05-03 00:00:00,Kolorowy droga pisać pragnienie górny malować roślina.
98e4e166-df75-4012-a564-21f03b3eed98,b34a1c6b-c3de-463f-8f11-6b9753b053d6,2023-12-06 00:00:00,2023-12-12 00:00:00,Zdrowie liść szczęście panować Turcja między walka.
24a5891f-7209-412b-b172-21ab05c2b4ca,e911f1d6-d7d5-4236-9c41-468199323cf6,2023-08-11 00:00:00,2023-08-19 00:00:00,Pomarańczowy 8 istota ssak głównie zwłaszcza zaś ciepło.
b78f8293-be50-428d-8ec0-daa972c55e13,44f89eec-201b-4072-b71d-b04980b3fbf8,2024-05-15 00:00:00,2024-05-17 00:00:00,Nikt podnosić grupa spotkać radio lud ćwiczenie.
f9ab9ac2-c125-4c9a-b45b-0ac3e6e71223,37315687-a543-4344-8e7c-6b3503e5e2d0,2024-09-06 00:00:00,2024-09-13 00:00:00,Kobiecy jednocześnie instytucja klub program przejść.
30ab4b48-7e57-4588-a6e5-496dc883384b,b34a1c6b-c3de-463f-8f11-6b9753b053d6,2024-04-10 00:00:00,2024-04-18 00:00:00,Przeciwko bitwa polski rachunek sylaba.
cc3ff113-1aba-4c3f-92ec-78a95542297b,37315687-a543-4344-8e7c-6b3503e5e2d0,2023-06-15 00:00:00,2023-06-24 00:00:00,Koniec opłata 40 patrzeć.
ab6e027a-fe2d-406d-a35b-98394107d221,50f7e288-efce-4a2c-b92f-6fb589aa19c4,2024-12-24 00:00:00,2024-12-30 00:00:00,Jakiś czynność wątpliwość liczba zapalenie dom uważać.
f5a7f90d-5474-4eda-811a-3a805d0b5919,55005c90-abde-446a-b266-31ed591660fe,2024-10-18 00:00:00,2024-10-23 00:00:00,Krótki znów umożliwiać igła 9 łąka.
2fe09121-51d4-49b7-bf39-339d386bb2f3,4e72af1c-c960-4fa7-8dd9-955d47006eb8,2024-11-17 00:00:00,2024-11-23 00:00:00,Przybyć wracać osiągnąć naprawdę.
bf05cb00-419d-473e-809b-957a2ca698e3,4e72af1c-c960-4fa7-8dd9-955d47006eb8,2023-06-25 00:00:00,2023-07-02 00:00:00,Częściowo chyba konstrukcja stowarzyszenie pojęcie czasownik film.
9cd308af-5b1f-4963-949a-eff8784d685c,44f89eec-201b-4072-b71d-b04980b3fbf8,2023-02-22 00:00:00,2023-03-02 00:00:00,Do piec listopad moc sądzić prowincja przyprawa Turcja.
b740f14f-2099-4e02-ae14-0d280ece76ba,e911f1d6-d7d5-4236-9c41-468199323cf6,2024-08-18 00:00:00,2024-08-28 00:00:00,Tajemnica właśnie sprzedawać piasek.
43969150-13e6-4e2d-afa1-4edc94d8d7af,55005c90-abde-446a-b266-31ed591660fe,2023-12-17 00:00:00,2023-12-22 00:00:00,Przeszłość płyn niewielki określony późny.
89a5c0a8-b0ca-4593-972d-228f31e03ce9,e911f1d6-d7d5-4236-9c41-468199323cf6,2024-09-09 00:00:00,2024-09-18 00:00:00,Kot umieszczać lub świat.
14759819-d839-4895-96c7-625b970d1702,2c8d274b-e56e-48a7-9d87-1d1654c37aa3,2023-10-27 00:00:00,2023-11-01 00:00:00,But zwłaszcza miękki.
04fa8504-f90c-40fd-8302-c81bfc142f2e,b64a662a-7c54-405c-a075-802d38b4ccf5,2024-08-10 00:00:00,2024-08-13 00:00:00,Gmina ? przeszłość bilet Morze Śródziemne.
981b49b9-7a03-4d98-af44-345acfc28447,55005c90-abde-446a-b266-31ed591660fe,2024-04-10 00:00:00,2024-04-18 00:00:00,U wtedy zanim żółty pozwalać.
6a2f08fa-964f-4975-a42e-e581843ff2f4,b64a662a-7c54-405c-a075-802d38b4ccf5,2024-04-24 00:00:00,2024-04-29 00:00:00,Region zgodnie dialekt duch późno istnieć.
fdb28847-2fdd-41da-b8b9-fdd96972480b,50f7e288-efce-4a2c-b92f-6fb589aa19c4,2023-05-22 00:00:00,2023-05-23 00:00:00,Stały 10 w..
3b15a843-c8ab-41df-bd2c-951401739b57,b64a662a-7c54-405c-a075-802d38b4ccf5,2023-07-23 00:00:00,2023-07-30 00:00:00,Usta gardło obywatelka niski z krwi i kości.
b180c914-b549-4e1d-a149-2ba8bed0dd23,44f89eec-201b-4072-b71d-b04980b3fbf8,2024-04-12 00:00:00,2024-04-20 00:00:00,Gość pragnąć zdobyć rada mi decyzja dziesięć.
019beebc-6bb2-4ee4-ab58-783946c807f1,4e72af1c-c960-4fa7-8dd9-955d47006eb8,2024-02-26 00:00:00,2024-02-27 00:00:00,Skłonność lewy przyjść dolina itp..
8c2a7592-29ed-4120-8a80-a6dc967bd71c,37315687-a543-4344-8e7c-6b3503e5e2d0,2023-05-12 00:00:00,2023-05-16 00:00:00,Kontrola ponad wyłącznie wieczorem.
d9e653b2-1a15-4cc8-a71e-adaf292818b2,e911f1d6-d7d5-4236-9c41-468199323cf6,2024-09-03 00:00:00,2024-09-12 00:00:00,Deska miasto ostry mięso odważny czeski stały.
70ca195b-81f6-4f17-821f-570bdce64395,37315687-a543-4344-8e7c-6b3503e5e2d0,2024-05-17 00:00:00,2024-05-23 00:00:00,Trwały sto tyle owca mieszkać silnik.
5e61bd2d-9483-4bb2-a764-c059bd0be0ab,f4a5ffd5-a74f-4187-a379-e75cf32a5e62,2023-09-25 00:00:00,2023-10-03 00:00:00,Królewski leczenie ustawa tkanina powinien poruszać się.
ab35cff4-1772-4e23-b612-138a92d97240,f4a5ffd5-a74f-4187-a379-e75cf32a5e62,2024-10-07 00:00:00,2024-10-09 00:00:00,Lud córka zbiór zostać rozmowa hodować w końcu.
c5b7f569-df27-4591-ae3b-de5802a8f3af,4e72af1c-c960-4fa7-8dd9-955d47006eb8,2023-10-16 00:00:00,2023-10-22 00:00:00,Piotr igła organ.
14416108-c193-4dac-9c5b-80e2141f906d,37315687-a543-4344-8e7c-6b3503e5e2d0,2024-05-20 00:00:00,2024-05-30 00:00:00,Latać poważny fizyczny piec promień zdanie mięsień 0.
d0f59d15-34b8-4034-a87f-4794cb4891a8,f4a5ffd5-a74f-4187-a379-e75cf32a5e62,2023-06-05 00:00:00,2023-06-07 00:00:00,Budzić oraz szkoła niedźwiedź twój kłaść działać.
a5af9edb-248f-4bed-acd4-3a0717a5ebc2,e911f1d6-d7d5-4236-9c41-468199323cf6,2024-05-28 00:00:00,2024-06-04 00:00:00,Dziać Się plemię komórka korzystać otrzymywać szczyt terytorium.
eab6e0c5-6c88-4460-88f5-63ab83f42b77,f4a5ffd5-a74f-4187-a379-e75cf32a5e62,2023-03-06 00:00:00,2023-03-12 00:00:00,Sąd pełnić wy.
a4e0db5f-d0ce-4205-8928-bfc420db2464,2c8d274b-e56e-48a7-9d87-1d1654c37aa3,2023-06-25 00:00:00,2023-07-05 00:00:00,Papier 40 gdzieś powiat.
8c684600-f329-4353-8473-716a6bc564ac,e911f1d6-d7d5-4236-9c41-468199323cf6,2024-08-05 00:00:00,2024-08-09 00:00:00,Przeznaczyć sowa wewnętrzny znajdować się.
cdd5de36-9ae0-4764-8b36-332212e35761,b34a1c6b-c3de-463f-8f11-6b9753b053d6,2024-05-25 00:00:00,2024-05-31 00:00:00,Przez koszula okręt.
a291f1ae-5a1b-4b1b-b972-4c663ae54b9f,e911f1d6-d7d5-4236-9c41-468199323cf6,2024-09-17 00:00:00,2024-09-18 00:00:00,Przestrzeń elektryczny kiedy łatwy podobny malować.
8f58072e-38f4-4750-92e8-e569db3a58f4,50f7e288-efce-4a2c-b92f-6fb589aa19c4,2023-05-28 00:00:00,2023-05-31 00:00:00,Gleba odmiana proszę.
afe1eaba-92b6-4247-ac59-5e42c3270997,2c8d274b-e56e-48a7-9d87-1d1654c37aa3,2023-06-14 00:00:00,2023-06-21 00:00:00,Dyrektor obejmować spaść mąka.
ff56d41b-7037-48f3-993e-fcb4aa83f2df,44f89eec-201b-4072-b71d-b04980b3fbf8,2023-12-07 00:00:00,2023-12-13 00:00:00,Umysł szklanka zamiar.
08d4c926-6ee2-41d9-9213-2ab778d2d8aa,37315687-a543-4344-8e7c-6b3503e5e2d0,2023-03-08 00:00:00,2023-03-09 00:00:00,Żeński styl lubić czerwony graniczyć.
7cb437d9-ac3f-4c8f-8fb3-1af77e81bfac,4e72af1c-c960-4fa7-8dd9-955d47006eb8,2024-06-07 00:00:00,2024-06-13 00:00:00,Opuścić 5 zakład Jan potem czarny wystawa wyglądać.
a99f6b55-2d10-40ba-a332-143dfbeb3f35,b34a1c6b-c3de-463f-8f11-6b9753b053d6,2024-08-02 00:00:00,2024-08-09 00:00:00,Gdyby wrogi tytoń mama.
fa926bfa-5e4b-4625-92ed-159eccdfe065,2c8d274b-e56e-48a7-9d87-1d1654c37aa3,2023-06-29 00:00:00,2023-07-09 00:00:00,Przyjąć zamieszkiwać można powiedzieć nieprzyjemny.
b3945b25-d1ec-4281-bc46-3ef813efdb88,b64a662a-7c54-405c-a075-802d38b4ccf5,2024-12-25 00:00:00,2024-12-29 00:00:00,Świeży olej wystawa pora rodowity.
71aa455d-6bce-4393-84ac-4b7026a50f13,2c8d274b-e56e-48a7-9d87-1d1654c37aa3,2024-09-15 00:00:00,2024-09-19 00:00:00,Małpa widok czy radio decyzja bitwa informacja dokładny.
17af2f51-281d-40c1-901f-bbc069b19979,f4a5ffd5-a74f-4187-a379-e75cf32a5e62,2024-08-11 00:00:00,2024-08-20 00:00:00,Więc dodawać skała niebieski 0.
78a64abf-f6df-4e30-8813-2990734c2bf3,b34a1c6b-c3de-463f-8f11-6b9753b053d6,2023-12-31 00:00:00,2024-01-05 00:00:00,Róg kierowca usługa nasienie pracownik.
e4d24f71-7167-4293-a130-2ae17444d74c,4e72af1c-c960-4fa7-8dd9-955d47006eb8,2024-09-07 00:00:00,2024-09-09 00:00:00,Śpiewać latać strój głupota miejscowość.
1d015118-c40b-40cb-8926-240fcf455029,44f89eec-201b-4072-b71d-b04980b3fbf8,2023-08-31 00:00:00,2023-09-05 00:00:00,Chyba nic dialekt przyjmować handlowy.
dcff5431-caf4-4a97-9df6-58750fe6c4cb,b34a1c6b-c3de-463f-8f11-6b9753b053d6,2024-01-01 00:00:00,2024-01-10 00:00:00,Korona główny okrągły matka tłuszcz.
acb6edfa-795b-4b39-bda4-99e2609a93d7,2c8d274b-e56e-48a7-9d87-1d1654c37aa3,2024-03-07 00:00:00,2024-03-14 00:00:00,Minerał japoński zając rezultat okolica kiedyś.
22c97454-3dca-41d8-8eca-fac7288e684f,44f89eec-201b-4072-b71d-b04980b3fbf8,2024-09-18 00:00:00,2024-09-24 00:00:00,Student skończyć dany serce ciąża jeść.
3a33e09c-047d-4efd-8462-30f15ffcebfe,b64a662a-7c54-405c-a075-802d38b4ccf5,2023-06-28 00:00:00,2023-06-29 00:00:00,Szósty pytać położony lato minister matka zachodni gniew.
e8e84a0d-0c3a-4d77-9e52-bf2e676d1087,37315687-a543-4344-8e7c-6b3503e5e2d0,2023-12-18 00:00:00,2023-12-24 00:00:00,Kierować rzadko postawić liczyć kolacja.
a735ea95-0a13-4e63-a8b7-70fd7bd273c5,50f7e288-efce-4a2c-b92f-6fb589aa19c4,2023-01-07 00:00:00,2023-01-10 00:00:00,Dwadzieścia przestać ważny obywatel.
b223b6f4-564c-4406-a342-cd4a16a8d8f0,44f89eec-201b-4072-b71d-b04980b3fbf8,2023-04-02 00:00:00,2023-04-09 00:00:00,Wódka uniwersytet biec wysoko.
37863a0e-09a4-4dea-b238-5736bf940465,2c8d274b-e56e-48a7-9d87-1d1654c37aa3,2024-11-04 00:00:00,2024-11-07 00:00:00,Futro prezent cały róg kraj smak.
